{
  "edition": "2026-10-19",
  "asOf": "2026-10-19",
  "updatedAt": "2026-10-19T07:10:57+08:00",
  "title": "香港 AI 日報",
  "weekday": "一",
  "intro": "今日重點：Microsoft 撤英國 AI 數據中心、DeepSeek V4.1-Flash、OpenCode key 外洩、Clark IMF GDP 情景、Claude 量子電路；基建要睇 KEDA／CSI／ingress-nginx CVE。政治：銳眼商場 CCTV、APEC 財長會、陳茂波增長、Vance 市政廳、中國貿易順差。",
  "mustKnow": [
    {
      "id": "mk-microsoft-nscale",
      "title": "Microsoft 撤出英國 Nscale Loughton AI 數據中心錨定租約",
      "summary": "英國新創 Nscale 喺 Essex Loughton 嘅主權 AI 數據中心項目，Microsoft 據報已終止租用／錨定協議。報道指電網側未必能喺 2030 年代前供應足夠電力；原計劃約 2027 年開業。AI 擴建已撞上電力同電網硬約束。",
      "source": "Guardian／BBC",
      "url": "https://www.theguardian.com/uk-news/2026/oct/18/microsoft-drops-huge-ai-datacentre-project-in-essex-over-power-supply-concerns",
      "published": "2026-10-18"
    },
    {
      "id": "mk-deepseek-v41-flash",
      "title": "DeepSeek 開源 V4.1-Flash-1017（MIT）並開放 Search／Fetch API",
      "summary": "DeepSeek 放出 V4.1-Flash-1017 權重（MIT），公司稱編碼／agent 基準較上一代 Flash 提升，並首次向開發者開放內部搜尋引擎嘅 Search／Fetch API（約 US$0.75／千次，免費試用至 10/31）。",
      "source": "Hugging Face",
      "url": "https://huggingface.co/deepseek-ai/DeepSeek-V4.1-Flash-1017",
      "published": "2026-10-17"
    },
    {
      "id": "mk-opencode-key-breach",
      "title": "OpenCode：蒸餾攻擊相關事故，約 1.4% Console 用戶 API key 或外洩",
      "summary": "開源編碼 agent OpenCode 披露與大規模蒸餾攻擊相關嘅保安事故，影響約 1.4% 已連結外部供應商嘅 Console 用戶；正與 Anthropic、OpenAI、Google 協作，並要求受影響用戶撤換 key。",
      "source": "On The Wire",
      "url": "https://onthewire.ai/article/opencode-says-a-breach-hit-1-4-of-its-console-users-an-email-shared-online-tells",
      "published": "2026-10-18"
    },
    {
      "id": "mk-clark-imf-gdp",
      "title": "Anthropic Jack Clark 喺 IMF／世行：極端情景下美 GDP 或至約 US$44 萬億",
      "summary": "喺曼谷 IMF／世行年會，Clark 稱內部模型喺技術持續進步等假設下，估算美國經濟產出可由現約 US$30 萬億以上升至約 US$44 萬億（2030）；同時警告生物／網絡誤用風險，呼籲設國際規則。",
      "source": "CNBC",
      "url": "https://www.cnbc.com/2026/10/17/ai-us-gdp-anthropics-clark.html",
      "published": "2026-10-17"
    },
    {
      "id": "mk-anthropic-quantum",
      "title": "Anthropic：Claude 閉環設計量子電路，資源代價代理指標最高可減約 39 倍",
      "summary": "Anthropic 研究帖稱畀 Claude Mythos 5 純文字規格＋自動評分器，喺八類量子電路原語上相對已發表最佳設計減少 qubit×Toffoli 等資源代理成本（最高約 39×）。強調尚未喺真實量子硬件跑通。",
      "source": "Anthropic",
      "url": "https://www.anthropic.com/research/designing-efficient-quantum-circuits",
      "published": "2026-10-16"
    }
  ],
  "tech": [
    {
      "id": "tech-keda-cve-77524",
      "title": "KEDA CVE-2026-77524（Critical）",
      "summary": "namespace admin 可經 TriggerAuthentication 令 operator 把 cluster 級 SA token 送到租戶控制嘅 Vault 地址，等同升到 cluster admin。用 Vault Kubernetes auth 就要升到 2.21.0。",
      "source": "KEDA GHSA",
      "url": "https://github.com/kedacore/keda/security/advisories/GHSA-637c-6jxx-4rwm",
      "published": "2026-10-18"
    },
    {
      "id": "tech-csi-smb-cve-3865",
      "title": "CSI SMB CVE-2026-3865 路徑穿越",
      "summary": "subDir／volumeHandle 路徑穿越，刪 volume 時可能誤刪 SMB export 外目錄；修喺 ≥ v1.20.1。允租戶自建 PV 指向 smb.csi.k8s.io 就要查 volumeHandle。",
      "source": "Kubernetes",
      "url": "https://discuss.kubernetes.io/t/security-advisory-cve-2026-3865-csi-driver-for-smb-path-traversal-via-subdir-may-delete-unintended-directories-on-the-smb-server/34448",
      "published": "2026-10-18"
    },
    {
      "id": "tech-csi-nfs-cve-3864",
      "title": "CSI NFS CVE-2026-3864 路徑穿越",
      "summary": "同款路徑穿越喺 NFS CSI；刪除／清理時可操作 export 外目錄；修喺 ≥ v4.13.1。應收緊 PV create 權限並升級 driver。",
      "source": "Kubernetes",
      "url": "https://github.com/kubernetes/kubernetes/issues/137797",
      "published": "2026-10-18"
    },
    {
      "id": "tech-ingress-nginx-cve-4342",
      "title": "ingress-nginx CVE-2026-4342（CVSS 8.8）",
      "summary": "Ingress annotation 可注入 nginx config，可致 controller 上下文 RCE 同洩露其可讀 Secrets。升到 v1.13.9／v1.14.5／v1.15.1。",
      "source": "Kubernetes",
      "url": "https://github.com/kubernetes/kubernetes/issues/137893",
      "published": "2026-10-18"
    },
    {
      "id": "tech-shorekeeper",
      "title": "ShoreKeeper：集群記憶體當統一池（arXiv 2610.13396）",
      "summary": "把集群記憶體當統一池，用 recovery-cost-aware 全域快取（含 preemptible 實例），Spark 迭代負載可快過節點本地 cost-aware 策略。",
      "source": "arXiv",
      "url": "https://arxiv.org/abs/2610.13396",
      "published": "2026-10-18"
    }
  ],
  "skills": [
    {
      "id": "sk-keda-vault-upgrade",
      "title": "KEDA 用 Vault Kubernetes auth → 升到 2.21.0",
      "summary": "CVE-2026-77524（Critical）：namespace admin 可經 TriggerAuthentication 令 operator 把 cluster 級 SA token 送到租戶控制 Vault，等同升到 cluster admin。影響 ≤2.20.2。",
      "source": "KEDA GHSA",
      "url": "https://github.com/kedacore/keda/security/advisories/GHSA-637c-6jxx-4rwm",
      "published": "2026-10-18"
    },
    {
      "id": "sk-csi-smb-subdir",
      "title": "CSI SMB：升 ≥v1.20.1，查 volumeHandle 有冇 ../",
      "summary": "CVE-2026-3865：subDir 路徑穿越，刪 volume 時可能誤刪 export 外目錄。允租戶自建 PV 指向 smb.csi.k8s.io 就要升同收權。",
      "source": "Kubernetes",
      "url": "https://discuss.kubernetes.io/t/security-advisory-cve-2026-3865-csi-driver-for-smb-path-traversal-via-subdir-may-delete-unintended-directories-on-the-smb-server/34448",
      "published": "2026-10-18"
    },
    {
      "id": "sk-csi-nfs-subdir",
      "title": "CSI NFS：升 ≥v4.13.1，收緊 PV create",
      "summary": "CVE-2026-3864：同款路徑穿越；刪除／清理時可操作 export 外目錄。應收緊 PV create 權限並升級 driver。",
      "source": "Kubernetes",
      "url": "https://github.com/kubernetes/kubernetes/issues/137797",
      "published": "2026-10-18"
    },
    {
      "id": "sk-ingress-nginx-upgrade",
      "title": "ingress-nginx：升到 v1.13.9／v1.14.5／v1.15.1",
      "summary": "CVE-2026-4342（CVSS 8.8）：annotation 可注入 nginx config，可致 RCE 同洩露 Secrets。查 rules.http.paths.path 有冇可疑值。",
      "source": "Kubernetes",
      "url": "https://github.com/kubernetes/kubernetes/issues/137893",
      "published": "2026-10-18"
    },
    {
      "id": "sk-shorekeeper-mem",
      "title": "Hadoop／Spark 迭代：留意全域 recovery-cost 快取",
      "summary": "ShoreKeeper（arXiv 2610.13396）把集群記憶體當統一池做 cost-aware 放置，preemptible 實例上亦可用；平台記憶體策略有參考價值。",
      "source": "arXiv",
      "url": "https://arxiv.org/abs/2610.13396",
      "published": "2026-10-18"
    }
  ],
  "politics": [
    {
      "id": "pol-hk-sharp-eye",
      "region": "香港",
      "title": "警方「銳眼」接駁私人商場閉路電視：商討進入最後階段",
      "what": "保安局局長鄧炳強（10/18）稱「銳眼」已接駁機場、鐵路及公共屋邨等 CCTV；私人商場商討已入最後階段。被問會否 24 小時實時接入，佢指視乎情況；商場會有攝錄提示，是否標明已駁入警方系統仍在商討。",
      "why": "監控範圍由公營設施伸向私人商場，牽涉私隱、罪案預防同公眾知情權之間嘅平衡。",
      "hkImpact": "市民出入商場嘅影像或更容易被警方系統取用；商場營運同私隱合規成本／爭議料上升。",
      "published": "2026-10-18",
      "sources": [
        {
          "name": "RTHK",
          "url": "https://news.rthk.hk/rthk/ch/component/k2/1874363-20261018.htm"
        }
      ]
    },
    {
      "id": "pol-hk-apec-finance",
      "region": "香港",
      "title": "APEC 財長會 10/20–21 首次喺港舉行",
      "what": "中國財政部說明 APEC 財長會將於 10 月 20–21 日喺香港舉行，約 21 個經濟體財長／代表及國際組織出席。議題包括民生財政政策、數碼基建融資、普惠金融等；會為 11 月深圳 APEC 領導人會議累積金融領域成果。",
      "why": "香港承接高層多邊財金會議，係地緣同金融話語權嘅展示場合。",
      "hkImpact": "短期會議經濟同曝光；中長期同離岸人民幣樞紐／財富管理敘事掛鈎，亦受中美博弈氣氛牽動。",
      "published": "2026-10-14",
      "sources": [
        {
          "name": "中國政府網",
          "url": "https://english.www.gov.cn/news/202610/14/content_WS6acf87bdc6d00ca5f9a0db19.html"
        },
        {
          "name": "SCMP",
          "url": "https://www.scmp.com/news/hong-kong/hong-kong-economy/article/3371251/why-hong-kong-hosting-apec-finance-ministers-meeting-there-another-agenda"
        }
      ]
    },
    {
      "id": "pol-hk-chan-growth-ai",
      "region": "香港",
      "title": "陳茂波：政府對今年增長較樂觀；港可助發展中經濟體建 AI 基建",
      "what": "財政司司長陳茂波（10/18）指剛出席曼谷 IMF／世行年會；IMF 將港 2026 實質 GDP 預測上調至 3.8%，本地政府預測區間為 3.5–4.5%；並稱港可匯聚全球資本，支援發展中經濟體建設 AI 基建，同時助內地企業走出去。",
      "why": "官方公開把融資＋科技／AI 基建寫入香港對外角色，同週末全球財金議程對齊。",
      "hkImpact": "强化「超級聯繫人」敘事；實際落地仍視乎地緣風險、資金流同項目風險定價。",
      "published": "2026-10-18",
      "sources": [
        {
          "name": "SCMP",
          "url": "https://www.scmp.com/news/hong-kong/hong-kong-economy/article/3371288/hong-kong-optimistic-economic-growth-despite-global-slowdown-paul-chan-says"
        },
        {
          "name": "RTHK",
          "url": "https://news.rthk.hk/rthk/en/component/k2/1874364-20261018.htm"
        }
      ]
    },
    {
      "id": "pol-us-vance-townhall",
      "region": "美國",
      "title": "副總統 Vance CBS 市政廳：答伊朗戰事、油價、移民同 H-1B",
      "what": "CBS 市政廳上，Vance 被選民追問伊朗戰事中陣亡美軍家屬個案、油價、移民執法同 H-1B 等言論。佢承認部隊部署有失誤並已調整；稱油價升高同中東局勢有關；就 H-1B 言論承認修辭唔完美。被問會否 2028 競選總統，佢話當然有機會唔選。",
      "why": "中期選舉前，行政當局要為戰事代價、生活成本同移民政策向本黨選民辯護。",
      "hkImpact": "美國內政撕裂同油價／制裁政策會間接影響全球風險偏好；港股同貿易融資對美政局敏感。",
      "published": "2026-10-18",
      "sources": [
        {
          "name": "PBS／AP",
          "url": "https://www.pbs.org/newshour/politics/vance-faces-tough-questions-on-iran-war-immigration-and-more-in-cbs-town-hall"
        }
      ]
    },
    {
      "id": "pol-cn-trade-surplus",
      "region": "中國",
      "title": "前九月貿易順差約 US$9381 億；周一公布三季 GDP",
      "what": "中國前九個月貿易順差約 US$9381 億；九月出口同比約 +36.3%、進口約 +31%，單月順差約 US$1335 億。官方將於 10/19 公布三季 GDP 及九月零售、工業、投資等數據。",
      "why": "巨大順差强化「外強內弱」結構爭議，亦加大主要貿易夥伴對再平衡同關稅／配額壓力。",
      "hkImpact": "港作為轉口同貿易融資樞紐，內地出口強而內需弱會影響物流同南向資金節奏；GDP 數字一出會即時影響風險資產情緒。",
      "published": "2026-10-19",
      "sources": [
        {
          "name": "AP",
          "url": "https://apnews.com/article/china-trade-exports-db43e08437b65f65c2ead64c82f9b990"
        },
        {
          "name": "China Daily",
          "url": "https://www.chinadaily.com.cn/a/202610/19/WS6ad52811e4b06d4aa05636bf.html"
        }
      ]
    }
  ]
}